{"app_installer_uri":"https://qualification.example.test/desktop/qualification/aaaaaaaaaaaaaaaaaaaaaaaaaaaaaaaa/probe.appinstaller","application_version":"0.7.5","distribution":"direct-appinstaller","identity":{"application_id":"Bridge","architecture":"x64","name":"OFCA.Qualification.Direct","publisher":"CN=OFCA MSIX Qualification Direct","publisher_display_name":"Dipsy"},"maximum_os_version_tested":"10.0.26340.0","minimum_os_version":"10.0.26100.0","purpose":"qualification","release_sequence":11,"schema":"ofca-msix-package-profile/v2","servicing":{"allowed_targets":{"engine_identity":{"architecture":"x64","family":"OFCA.Qualification.TextEngine_0123456789abc","name":"OFCA.Qualification.TextEngine","publisher":"CN=OFCA MSIX Qualification Direct"},"kind":"main_package_and_related_bundle"},"installed_artifact":{"engine":{"identity":{"architecture":"x64","family":"OFCA.Qualification.TextEngine_0123456789abc","name":"OFCA.Qualification.TextEngine","publisher":"CN=OFCA MSIX Qualification Direct"},"package_version":"1.0.42.0"},"kind":"related_bundle","related_set_id":"related.11"}},"webview2_minimum_version":"134.0.3124.0"}
